{"$schema":"https://json-schema.org/draft/2020-12/schema","type":"object","additionalProperties":false,"required":["repository","revision","license","required_roles","local_files","expected_checksums","missing_roles","checksum_mismatches","local_verification_status","upstream_identity"],"properties":{"repository":{"const":"m-a-p/MERT-v1-95M"},"revision":{"const":"12af15fef9d0ac838c3f475bfbbf26d2060dd4f5"},"license":{"const":"cc-by-nc-4.0"},"required_roles":{"type":"array"},"local_files":{"type":"object"},"expected_checksums":{"type":"object"},"missing_roles":{"type":"array"},"checksum_mismatches":{"type":"array"},"local_verification_status":{"enum":["VERIFIED","BLOCKED_MISSING_LOCAL_BYTES","EXPECTED_CHECKSUMS_UNREGISTERED","CHECKSUM_MISMATCH"]},"upstream_identity":{"type":"string","pattern":"^[0-9a-f]{64}$"},"supersedes":{"type":"string"},"correction_reason":{"type":"string"}}}
