{
  "checksum_mismatches": [],
  "correction_reason": "production expected checksum registry is code-controlled and incomplete",
  "expected_checksums": {
    "weights": "a2b8b747f72c06e0595aeae41ae5473f4364938c6b39b2c58be38c48e6bd3fcd"
  },
  "license": "cc-by-nc-4.0",
  "local_files": {},
  "local_verification_status": "EXPECTED_CHECKSUMS_UNREGISTERED",
  "missing_roles": [
    "config",
    "processor",
    "weights"
  ],
  "repository": "m-a-p/MERT-v1-95M",
  "required_roles": [
    "config",
    "processor",
    "weights"
  ],
  "revision": "12af15fef9d0ac838c3f475bfbbf26d2060dd4f5",
  "supersedes": "reports/preflight/mert-primary-local-status-v2.json",
  "upstream_identity": "3424da209d14f426e35e65929f8e9d3462738bf7793af199059635437c586703"
}
